<?xml version="1.0" encoding="UTF-8"?>
<AuditedApplication			
    xmlns:xsi="http://www.w3.org/2001/XMLSchema-instance"
    xmlns="http://www.hpe.com/CAF/Auditing/Schema/AuditedApplication.xsd" 
    xsi:schemaLocation="http://www.hpe.com/CAF/Auditing/Schema/AuditedApplication.xsd"			
>
	<ApplicationId>ProductX</ApplicationId>
	<AuditEvents>
	  <AuditEvent>
		<TypeId>viewDocument</TypeId>
		<CategoryId>documentEvents</CategoryId>
		  <Params>
			  <Param>
				  <Name>param1</Name>
				  <Type>string</Type>
				  <Description>Description for param1</Description>
			  </Param>
			  <Param>
				  <Name>param2</Name>
				  <Type>short</Type>
				  <Description>Description for param2</Description>
			  </Param>
			  <Param>
				  <Name>param3</Name>
				  <Type>int</Type>
				  <Description>Description for param3</Description>
			  </Param>
			  <Param>
				  <Name>param4</Name>
				  <Type>long</Type>
				  <Description>Description for param4</Description>
			  </Param>
			  <Param>
				  <Name>param5</Name>
				  <Type>float</Type>
				  <Description>Description for param5</Description>
			  </Param>
			  <Param>
				  <Name>param6</Name>
				  <Type>date</Type>
				  <Description>Description for param6</Description>
			  </Param>
		  </Params>
	  </AuditEvent>
	</AuditEvents>
</AuditedApplication>
